{
    "definitions": {},
    "$schema": "http://json-schema.org/draft-07/schema",
    "$id": "http://example.com/example.json",
    "type": "object",
    "title": "The root schema",
    "description": "The root schema comprises the entire JSON document.",
    "examples": [
        {
            "category": "education",
            "name": "Tnteractive Whiteboard AVTEK TT-BOARD 80",
            "description": "Interactive whiteboard that can stream a computer screen with ability to manipulate a view by user.",
            "price": 5849.0
        }
    ],
    "required": [
        "category",
        "name",
        "description",
        "price"
    ],
    "properties": {
        "category": {
            "$id": "#/properties/category",
            "type": "string",
            "title": "The category schema",
            "description": "An explanation about the purpose of this instance.",
            "minLength":3,
            "examples": [
                "education"
            ]
        },
        "name": {
            "$id": "#/properties/name",
            "type": "string",
            "title": "The name schema",
            "description": "An explanation about the purpose of this instance.",
            "minLength":3,
            "examples": [
                "Tnteractive Whiteboard AVTEK TT-BOARD 80"
            ]
        },
        "description": {
            "$id": "#/properties/description",
            "type": "string",
            "title": "The description schema",
            "description": "An explanation about the purpose of this instance.",
            "minLength":3,
            "examples": [
                "Interactive whiteboard that can stream a computer screen with ability to manipulate a view by user."
            ]
        },
        "price": {
            "$id": "#/properties/price",
            "type": "number",
            "title": "The price schema",
            "description": "An explanation about the purpose of this instance.",
            "exclusiveMinimum": 0,
            "examples": [
                5849.0
            ]
        }
    },
    "additionalProperties": false
}